{
  "$schema": "https://json-schema.org/draft/2020-12/schema",
  "$id": "https://pixel.local/schemas/activation-v2-project-auto-state-v1.json",
  "title": "ActivationV2ProjectAutoStateV1",
  "type": "object",
  "additionalProperties": false,
  "required": ["schema_version", "project_id", "revision", "entries", "state_digest"],
  "properties": {
    "schema_version": {"const": 1},
    "project_id": {"type": "string", "pattern": "^[a-z0-9][a-z0-9._-]{0,63}$", "maxLength": 64},
    "revision": {"type": "integer", "minimum": 0, "maximum": 2147483647},
    "entries": {"type": "array", "maxItems": 64, "uniqueItems": true, "items": {"$ref": "#/$defs/entry"}},
    "state_digest": {"type": "string", "pattern": "^[0-9a-f]{64}$", "maxLength": 64}
  },
  "$defs": {
    "counts": {
      "type": "object",
      "additionalProperties": false,
      "required": ["decisions", "evidence", "open_tasks", "questions", "global_candidates"],
      "properties": {
        "decisions": {"type": "integer", "minimum": 0, "maximum": 32},
        "evidence": {"type": "integer", "minimum": 0, "maximum": 32},
        "open_tasks": {"type": "integer", "minimum": 0, "maximum": 32},
        "questions": {"type": "integer", "minimum": 0, "maximum": 32},
        "global_candidates": {"type": "integer", "minimum": 0, "maximum": 32}
      }
    },
    "entry": {
      "type": "object",
      "additionalProperties": false,
      "required": ["transaction_id", "closure_id", "closure_digest", "task_outcome", "candidate_counts", "committed_revision", "state", "rollback_revision"],
      "properties": {
        "transaction_id": {"type": "string", "pattern": "^project-auto:[0-9a-f]{8}-[0-9a-f]{4}-[0-9a-f]{4}-[0-9a-f]{4}-[0-9a-f]{12}$", "maxLength": 50},
        "closure_id": {"type": "string", "pattern": "^closure:[0-9a-f]{8}-[0-9a-f]{4}-[0-9a-f]{4}-[0-9a-f]{4}-[0-9a-f]{12}$", "maxLength": 44},
        "closure_digest": {"type": "string", "pattern": "^[0-9a-f]{64}$", "maxLength": 64},
        "task_outcome": {"enum": ["completed", "partial", "blocked"]},
        "candidate_counts": {"$ref": "#/$defs/counts"},
        "committed_revision": {"type": "integer", "minimum": 1, "maximum": 2147483647},
        "state": {"enum": ["active", "rolled_back"]},
        "rollback_revision": {"type": ["integer", "null"], "minimum": 2, "maximum": 2147483647}
      }
    }
  }
}
